{
  "$schema": "https://sethmay.github.io/open-scout-api/schema/v1/training.schema.json",
  "id": "p44-sea-scout-adult-ldr-basic-training",
  "kind": "training",
  "versions": [
    {
      "valid_from": null,
      "valid_to": null,
      "code": "P44",
      "name": "Sea Scout Adult Ldr Basic Training",
      "delivery": "unknown",
      "renew_months": null,
      "provenance": {
        "sources": [
          {
            "citation": "Scouting America, Trained Leader Requirements - Unit and Other Positions",
            "url": "https://filestore.scouting.org/filestore/training/pdf/trained_leader_positions.pdf"
          }
        ],
        "method": "curated",
        "verified_at": "2026-07-27",
        "confidence": 0.9,
        "notes": null
      }
    }
  ],
  "notes": null
}
